,oid,timestamp,rpid,uid,uname,content,likes,replies
465,1503009747,1713071246,216819955696,585123809,太过分吃饭123,真是6666,0,0
61,1503009747,1713180983,217020510848,19103912,爱跑步,好的是真的 不好的也是真的,0,0
553,1503009747,1713060372,216793293680,40531802,望山人,这么敢拍,0,0
323,1503009747,1713094722,216875403872,95738649,大民小人,为了孩子,0,0
162,1503009747,1713143662,216946337968,149938,名字特别酷,up是我们重庆的吗 看这么多次才知道,0,0
620,1503009747,1713035270,216771320560,21954281,喵喵和小不点,台湾拍大陆肯定敢拍嘛~编剧沙叶新老师是大陆人，我很喜欢，我们学校编剧专业毕业的研究生，算是老前辈啦（虽然不是一个专业），前几年去世的时候朋友圈都是纪念他的文章。,7,0
1160,1503009747,1712967049,216622303888,39404747,皮皮大王健康成长,怎么有一种港台腔。发国,2,0
1064,1503009747,1712988083,216665844672,383244093,唯无常不变,"孙子：我以后能当将军吗？
爷爷：当然可以了，像我一样！
孙子：那我能当元帅吗？
爷爷：不能！元帅也有孙子……",3,0
1024,1503009747,1712992511,216674891152,3494357061601519,打的好111,现在不能拍了只能来来回回玩以前的几个电影[喜极而泣],10,3
551,1503009747,1713060817,216794177728,3546590037936297,飞鸿踏雪呢,真实,2,0
836,1503009747,1713010353,216716910208,37595251,两无成QAQ,拍的挺好的,0,0
612,1503009747,1713046057,216776302864,3546554384255510,秦小天1999,还有这么牛逼的电影啊,0,0
711,1503009747,1713022943,216751401648,456716368,狂洒,被扭曲的扭曲回来就刺痛了人心。,0,0
514,1503009747,1713065943,216805832832,687640974,无敌丶大彩,美国人好惨，日本人可恨，欧洲人虚伪。,1,0
329,1503009747,1713093852,216873227760,13861443,青瓜sama,国内最幸福的单位是yancao、没有之一。但你猜啥人能进这个局？我也好想是gaogan的儿子啊[大哭][大哭][大哭][大哭],1,0
586,1503009747,1713054233,216782604896,16172227,梦玖岁月,"最最讽刺的是：这个剧镜头里只有城市下放的青年，没有农村本来的青年，事实上他们才是大多数人，他们也想和下放子弟站在同一起跑线上。
突然想起进击的巨人，原来在人们心里呀，真的有那一层一层的高墙。",408,13
1135,1503009747,1712972975,216631418560,2888614,supercoco88,真人真事,13,0
452,1503009747,1713073020,216824541152,388585369,万能的B站网友,很多东西不会因为你揭露出来而改变，顾好自己，很多东西不是我们普通人能讨论的,0,0
568,1503009747,1713057770,216788185392,3461570371783119,bili_80866567918,怪不得男主看着面熟,0,0
1039,1503009747,1712990883,216671613760,59424216,Troup_,所以我做错了什么😐,0,0
326,1503009747,1713094242,216874198768,10361924,Chang张狗胜,继承银行当然是朴素的愿望啦,3,0
908,1503009747,1713003986,216700548624,8064906,ずんだもんちゃん,🐘啊，𬣳🐘啊,1,0
460,1503009747,1713072300,216822763520,81449528,江总总,我们名族比较儒雅，不像美国一直在对外打仗掠夺资源，给本国人福利，强盗行为[脱单doge],0,1
896,1503009747,1713005169,216703712864,387855292,-不要让我起昵称-,是谭咏麟吗？,0,1
910,1503009747,1713003352,216698848304,482239850,谎言的蜜糖真相的快刀,正常正常正常啦，稀松平常的事说出来干嘛,188,12
95,1503009747,1713168941,216993739712,177631820,欣旺-震旦天朝,https://b23.tv/xHhHq1P,0,0
569,1503009747,1713057699,216788018928,3626768,我脸好白,"这部电影，我给我父母看了，他们看了之后给我讲了个故事，讲了个我老家版本的《假如我是真的呢》男主，但是，这次这位“男主”他的做法、心态、结局完全不一样，且其家庭条件比电影里男主条件更糟糕（我老家这位姓拼音开头是z，我就叫他Z叔叔吧）：我老家是个小县，不大也不咋富，那时候Z叔叔也是被发配下乡（县下面的落乡里的农场），而且他的情况更麻烦，首先他家只是县里的，家里面只有老父亲一人，他老父亲当时还不是种田或者厂里的正式工，而是经营着一个效益不好的小卖部的，也因此被打上了某个标签，因此Z叔叔还是带着标签被发配下乡的（关键被打了那个标签却也没什么钱），但Z叔叔下乡到了农场以后一没有看别人关系自己也想找二没有胡思乱想（也幸好他也没什么发小）就是埋头苦干，最后他在那个农场做到什么程度了呢，生产队长，而且当所有下乡知青全部该找关系回调找关系回调该自然往回挪往回挪的时候他依旧埋头苦干，最后他是最后一个被调回县城的，当时生产队那边的老干部（这个干部我家里也认识，小时候也经常见到他，是个很豪爽的人）一提到这个Z叔叔都是竖起大拇指说“哎呀，你说小Z啊，他好啊!这人绝对行!”之后Z叔叔调回县城以后他父亲。。。然后他就孤身一人了，然后就调进了厂里，在厂里他依旧埋头苦干，之后成为了副厂长，但你以为他这一辈子就稳了吗?别忘了当时有一个情况，那就是到了后来很多大工厂都面临倒闭，这位Z叔叔所在的厂也不幸面临倒闭，厂倒闭后Z叔叔又要忙于找工作，但是以他的履历和这些年结交得人脉也很快找到了新工作，结局呢就是他找到了新的工作单位，继续他的勤劳、埋头苦干，再后来老婆孩子热炕头，再再后来孩子大学毕了业正常进入社会。
我父母和我讲这个故事的同时也告诉我，当时那个年代像男主这种情况的人很多，像他这样极端结局的人也有，但这个结局绝对不是唯一的选择，人可以选择让自己过的好的[微笑][微笑][微笑]",367,84
811,1503009747,1713012581,216722702528,394914960,北海42,只得一声叹,0,0
832,1503009747,1713010972,216718567024,295979876,人民的乙方,了不起，非常的真实。,0,0
560,1503009747,1713059446,216791289584,3546640291989716,战地28,哎，一直如此都是这样，真心累，看人太多了有时候真的更喜欢和狗猫待一起。,2,0
744,1503009747,1713019689,216742662448,3546389069957679,碧池ll,在网上搜了搜，是台湾拍的，不过确实很真实,1,0
502,1503009747,1713067254,216809297744,1926432572,索罗西科亚,旧社会信息不流通，这种剧情理论上有可能发生的。,11,1
775,1503009747,1713016293,216733040528,66850807,nei最近还好吗,哈哈哈,0,0
872,1503009747,1713007217,216708946256,286333087,某福有病少管,传承,4,0
221,1503009747,1713112909,216921629136,4430124,Dandelion2020,假如我是清流水，也要泪儿流,1,0
1208,1503009747,1712962569,216618344512,3537122732542555,CLAY_1,惹阿,2,0
174,1503009747,1713138670,216939905952,2042756105,崩溃boy,第一眼看成麻豆[奥比岛_委屈],0,0
382,1503009747,1713085662,216852982816,283200635,宮崎將吾,记录过去，预言未来,1,0
318,1503009747,1713095256,216876814720,836396,开香槟咯-,f痋魅力时刻,0,0
40,1503009747,1713186989,217035021536,33771766,Nero65,"Como meñor, adúltero, traicionero a la revolución, desorganizado y sin disciplina.",0,0
628,1503009747,1713034335,216770518528,389631199,原批笑话合集,这up可太幽默了，把沙俄当成苏联。你咋不把新中国当清朝呢？[抠鼻]这么快就暴露你的成分了,2,1
400,1503009747,1713081781,216844211120,2764729,蛟龙Tomy,最后那段文字多么讽刺啊 说的是李小璋不肯脚踏实地 实则全剧对于李小璋做出这种走捷径的原因给出了相当充实的解释 这是一部明显批判当时社会的电影 讽刺的是他不得在最后将错归结于李小璋才能够上映,0,0
709,1503009747,1713023183,216752081152,481177628,筱靥屮,从今天起，不自我逃避，我曾经也埋怨过我没有一个好爸爸，但事实是有人在窃取伟人带领人民创建的伟大果实！我自然的发生:不！！！！！！,2,3
682,1503009747,1713024935,216756215664,111740457,新的大呗,狠片。。,0,0
1111,1503009747,1712977676,216640974768,444735971,谢文东北京科技大学,剧中李达一出场，不怒自威。也许有一分好奇，不在第一时间戳穿，想看这是如何的一张网。后面也许有一分愧意，长江昔日击楫声，而今有愧毅重名。但救校长百害无一利，只能处理他。,1741,34
226,1503009747,1713111617,216918781616,2241106,pinkor,居然是谭校长演的[哦呼],2,0
537,1503009747,1713062429,216797592928,276854263,在下云影,任何时候都应欢迎这样的电影，这样的声音，国家才能进步，人民才能得到公平,0,0
987,1503009747,1712998001,216686380208,340340378,三千树叶OoO,不得不说，李小樟演技和心理素质确实过硬,53,3
621,1503009747,1713035063,216771083008,67352440,Nhdfgredeeeeee,不是你老发给我们这种底层看了干嘛 啥意思啊,2,1
968,1503009747,1712999564,216689888272,521430179,千千萬萬個我,30:05 最后的这段白字的话，让全片达到了最高潮,162,15
454,1503009747,1713072865,216824205632,454694939,bili_67374159357,这是咱们台湾省拍的哦，可能会有一点点的艺术性夸大成分[doge],10,14
327,1503009747,1713094212,216874173088,110107672,魔人布欧胖乎乎,一群数字生命，蝇蝇蝇，嘤嘤嘤。没用的。,1,0
782,1503009747,1713015586,216730879392,440510114,火箭大套餐,你现在能搜到 b0。 西莱不[喜极而泣],9,5
984,1503009747,1712998074,216686589152,385730741,SsciNoi,戳粉区自尊,1,0
638,1503009747,1713032615,216768883328,23890940,清errr,东野毕之失马[笑],0,0
861,1503009747,1713008545,216712232672,8734556,树下啃面包,片中提到的李达将军在1993年逝世，也就是说将军本人在世的时候很可能听说过甚至看过这部电影,2091,33
1032,1503009747,1712991541,216672857808,3546583215900794,玄学小馆,以前的影视剧老百姓真的喜欢看[支持],2,0
213,1503009747,1713115801,216926278992,406281854,真嗣没劲,世界就是一个巨大的舞台，就看谁最会演戏,1,0
206,1503009747,1713116766,216927457872,1256839660,查重报告,看来，怨气冲天了,1,0
552,1503009747,1713060554,216793683792,4645594,与心搏斗,总有一天沉默也会被视为背叛,1,0
494,1503009747,1713068743,216813318160,13053062,勿关風月,@千千静听__ 好看,0,1
1069,1503009747,1712986999,216663471728,26598249,阿基米德的洗澡盆,到最后的立意居然是要提醒的是想走捷径的人吗……难道不是……？？？[吃瓜],278,24
30,1503009747,1713188738,217039270496,1033836259,幻影中追寻你的踪迹,这个世界不存在假如，也不会有假如,1,0
590,1503009747,1713053333,216781484112,58163958,我为小丑鱼的爱情冲出鱼塘,[吃瓜]像啊像啊 小说也是这样写,0,0
77,1503009747,1713176315,217008853024,598699322,爱打游戏的昊仔,"王童，1942年4月4日出生于中国安徽太和县，毕业于台湾艺术专科学校，中国台湾男导演、编剧、制片人、美术指导。
1981年，执导导演处女作《假如我是真的》，凭借该片获得第18届台湾电影金马奖最佳美术设计提名 【1】。1982年，拍摄爱情电影《苦恋》，该片获得第19届台湾电影金马奖最佳剧情片提名 【2】。1983年，执导剧情片《看海的日子》，该片获得第20届台湾电影金马奖最佳剧情片提名 【3】。1984年，执导古装片《策马入林》，由此获得第22届台湾电影金马奖最佳美术设计奖和最佳服装设计奖 【4】。1985年，拍摄喜剧电影《阳春老爸》。1987年，执导剧情片《稻草人》，由此获得第24届台湾电影金马奖最佳导演奖 【5】。1989年，执导剧情片《香蕉天堂》，凭借该片获得了第26届台湾电影金马奖最佳服装设计提名 【6】。1992年，执导剧情片《无言的山丘》，因此获得第29届台湾电影金马奖最佳导演奖 【7】。1996年，编导剧情片《红柿子》，凭借该片获得第33届台湾电影金马奖最佳导演奖提名 【8】。2002年，执导剧情片《自由门神》。2004年，在青春版昆曲《牡丹亭》中担任美术设计和服装设计。2005年，执导个人首部动画长片《红孩儿大话火焰山》，该片获得第42届台湾电影金马奖最佳动画长片奖 【9】、第11届中国电影华表奖优秀动画片奖 【10】。",5,2
91,1503009747,1713170852,216997171216,126086761,尼古拉斯---大炮,千言万语化作一声叹息[辣眼睛],0,0
1127,1503009747,1712974292,216633903184,571819128,王泥溤,李大爷[星星眼],0,0
523,1503009747,1713065111,216803880352,699606475,小小水瓶瓶,谭校长多年后演唱电影主题曲https://b23.tv/BV1JM4y1p7mX,0,0
60,1503009747,1713181416,217021615696,287385804,一瞬的扯淡,竟然是谭咏麟,1,0
983,1503009747,1712998253,216686919744,3546612108363980,姬波常,不想看了  只有干生气     无可奈何,1,0
84,1503009747,1713173126,217001701152,3493080877500660,bili_41920836170,理想与现实,0,0
715,1503009747,1713022617,216750538976,102771532,龙的传人l,男主这么nb他居然只为了上调,0,1
863,1503009747,1713008521,216712278128,1148091092,唯物天奇,生活中确实存在蝇营狗苟，但很多人恨的不是特权，而是恨自己不是特权，想走捷径不想吃苦这是人之常情，抱怨换来的只有醋味，做好自己就行,0,1
487,1503009747,1713068999,216814036352,1407269630,SHuoik,我爸当年当兵考上军校了，结果只有一个名额，被军长的儿子挤掉了[笑哭],19,12
802,1503009747,1713013051,216723958704,243934183,Yuyu呢_,拍了有什么用？,1,0
75,1503009747,1713176555,217009600336,477930858,浮云咸鱼剑,挺悲伤的,0,0
196,1503009747,1713123623,216932705952,1473425424,小巷子里最靓的仔,男女主都有觉悟，如果脑洞大可以配合演戏栽赃嫁祸[呲牙],0,0
15,1503009747,1713193014,217050895184,77122602,哈咯嘛呀,"我比较摆，只要不影响到家人生活爱咋咋滴
而且我只相信我见的，不巧的时运气不错都见过些，可惜说不出啊",0,0
591,1503009747,1713052544,216780666400,330178062,高冷的汤米维赛提,我爸和我大爷一个是塔吊队队长一个是司机我去单位只能当施工员 我们项目经理他爸是他们市的民政局的局长他叔叔是单位的副总 他上班就是项目经理 所以说呵呵了,2,0
798,1503009747,1713013447,216724945920,348679031,渡渡挤,山雨欲来风满楼,0,0
1034,1503009747,1712991378,216672465488,3546393106975470,刻成盘,赵团长演过一版灭绝,1,0
570,1503009747,1713057573,216787791664,445684376,资源收藏者,真好,0,0
167,1503009747,1713142319,216944414496,3461568251562540,核动力员工,这片是台湾拍的？,0,0
176,1503009747,1713138429,216939817424,486661741,梦想编织未来,现在拍过不了审，只能看老片来回忆了,4,1
1192,1503009747,1712964006,216619272400,489525593,李知恩为何下凡I,女主是邓丽君？,1,6
923,1503009747,1713002677,216697144192,4200845,前尘渡月梦,笑死我了，说这些都没用的，只怪我们没有一个好爸爸,1,0
321,1503009747,1713094921,216875743776,261062765,富士风味,我没看 我没听 我没懂,0,0
222,1503009747,1713112757,216921119600,43951576,爬出井的蛙,一百多万的up主，居然敢发这样的视频，你是真打算最后一期了吗？[笑哭],0,0
315,1503009747,1713095542,216877400320,238538300,啊呀哟喂喂,我记得小时候和爸妈一起看台湾片，没有现在这种台湾腔啊，为什么现在台湾腔和以前大不一样了？,5,1
163,1503009747,1713143498,216946042064,1465036720,天启袁浩,这一开场的几句很震撼[doge],0,0
1184,1503009747,1712964571,216619756224,293649310,猪蹄不啃咽不下,以前农村户口到城里工作都很难呢[呲牙],58,11
547,1503009747,1713061619,216795752528,1369683675,CHENB2575,谭咏麟演的不错啊,3,0
1169,1503009747,1712966035,216621191920,1914322696,bili_注册答了一百道题,中肯的,3,0
303,1503009747,1713097083,216881194640,44630452,骑狗上阵,最让我恶心的是的让我摇号油改电，应着4年后也就是24年就有电指标，我改了，第二年添加家庭摇号，把我这个推到30年，这跟诈骗有什么区别,2,3
1207,1503009747,1712962683,216618482944,3546585151572710,武文吞道,谭校长,36,0
506,1503009747,1713066475,216807169056,242297770,以爱之名521,唉，当年苦啊,0,0
829,1503009747,1713011123,216718798880,23038701,青藤白阳丶,所以到底有什么好办法呢？难道说真要按那老人家的法子来？[桃源_乖巧][桃源_乖巧],1,0
484,1503009747,1713069085,216814194976,385554610,迦南圣经,"王老师:哦，说到这里，人家圆滑的作文又获得了……题目是《我的区长……》
夏洛:人家拼的是学习嘛[藏狐]……
王老师:管人家拼什么，拼不过就……",0,0
22,1503009747,1713191059,217045353152,689286862,聪明的human,得直视问题 而不是见到就阴阳怪气,3,0
125,1503009747,1713157429,216973381344,1418652698,白色的黑墨_,先缓存吧[笑哭][笑哭],0,0
